{
  "schemaVersion": "1.0",
  "modelId": "personal-stack.authz",
  "version": "0.2.0",
  "description": "Shared authorization vocabulary sample derived from the personal-stack auth-api domain.",
  "authorityFormats": {
    "rolePrefix": "ROLE_",
    "servicePermissionPrefix": "SERVICE_",
    "rolesHeaderSeparator": ","
  },
  "artifacts": {
    "maven": {
      "groupId": "dev.jorisjonkers",
      "artifactId": "authz-model",
      "packageName": "dev.jorisjonkers.authz.model"
    },
    "typescript": {
      "packageName": "@jorisjonkers-dev/authz-model"
    }
  },
  "roles": [
    {
      "id": "shared.role.admin",
      "key": "ADMIN",
      "authorityValue": "ROLE_ADMIN",
      "description": "Administrative role authority surfaced to consumers.",
      "namespace": "shared",
      "owner": "authz-model",
      "scope": "shared",
      "status": "active"
    },
    {
      "id": "shared.role.user",
      "key": "USER",
      "authorityValue": "ROLE_USER",
      "description": "Standard user role authority surfaced to consumers.",
      "namespace": "shared",
      "owner": "authz-model",
      "scope": "shared",
      "status": "active"
    },
    {
      "id": "shared.role.readonly",
      "key": "READONLY",
      "authorityValue": "ROLE_READONLY",
      "description": "Read-only role authority surfaced to consumers.",
      "namespace": "shared",
      "owner": "authz-model",
      "scope": "shared",
      "status": "active"
    }
  ],
  "claims": [
    {
      "id": "shared.claim.roles",
      "key": "roles",
      "name": "roles",
      "channel": "jwt-claim",
      "valueShape": "authority-array",
      "allowedAuthorityFormats": ["role", "service-permission"],
      "description": "Token claim carrying role and service-permission authorities.",
      "namespace": "shared",
      "owner": "authz-model",
      "scope": "shared",
      "status": "active"
    },
    {
      "id": "shared.claim.username",
      "key": "username",
      "name": "username",
      "channel": "jwt-claim",
      "valueShape": "string",
      "description": "Canonical username identity claim.",
      "namespace": "shared",
      "owner": "authz-model",
      "scope": "shared",
      "status": "active"
    },
    {
      "id": "shared.claim.preferred-username",
      "key": "preferredUsername",
      "name": "preferred_username",
      "channel": "jwt-claim",
      "valueShape": "string",
      "description": "OpenID Connect preferred username claim.",
      "namespace": "shared",
      "owner": "authz-model",
      "scope": "shared",
      "status": "active"
    },
    {
      "id": "shared.claim.email",
      "key": "email",
      "name": "email",
      "channel": "jwt-claim",
      "valueShape": "string",
      "description": "Email identity claim.",
      "namespace": "shared",
      "owner": "authz-model",
      "scope": "shared",
      "status": "active"
    },
    {
      "id": "shared.claim.email-verified",
      "key": "emailVerified",
      "name": "email_verified",
      "channel": "jwt-claim",
      "valueShape": "boolean",
      "description": "Email verification state claim.",
      "namespace": "shared",
      "owner": "authz-model",
      "scope": "shared",
      "status": "active"
    },
    {
      "id": "shared.claim.audience",
      "key": "audience",
      "name": "aud",
      "channel": "jwt-claim",
      "valueShape": "string-array",
      "description": "Audience claim for token consumers.",
      "namespace": "shared",
      "owner": "authz-model",
      "scope": "shared",
      "status": "active"
    },
    {
      "id": "shared.claim.subject",
      "key": "subject",
      "name": "sub",
      "channel": "jwt-claim",
      "valueShape": "string",
      "description": "Subject identifier claim.",
      "namespace": "shared",
      "owner": "authz-model",
      "scope": "shared",
      "status": "active"
    },
    {
      "id": "shared.claim.token-type",
      "key": "tokenType",
      "name": "type",
      "channel": "jwt-claim",
      "valueShape": "token-type",
      "description": "Token type discriminator claim used for non-access-token flows.",
      "namespace": "shared",
      "owner": "authz-model",
      "scope": "shared",
      "status": "active"
    },
    {
      "id": "shared.claim.groups",
      "key": "groups",
      "name": "groups",
      "channel": "jwt-claim",
      "valueShape": "string-array",
      "description": "Optional external group membership claim.",
      "namespace": "shared",
      "owner": "authz-model",
      "scope": "shared",
      "status": "active"
    },
    {
      "id": "shared.header.forwarded-user-id",
      "key": "forwardedUserId",
      "name": "X-User-Id",
      "channel": "http-header",
      "valueShape": "string",
      "description": "Forwarded identity header carrying the authenticated user identifier.",
      "namespace": "shared",
      "owner": "authz-model",
      "scope": "shared",
      "status": "active"
    },
    {
      "id": "shared.header.forwarded-user-roles",
      "key": "forwardedUserRoles",
      "name": "X-User-Roles",
      "channel": "http-header",
      "valueShape": "comma-separated-authorities",
      "allowedAuthorityFormats": ["role", "service-permission"],
      "description": "Forwarded identity header carrying comma-separated authorities.",
      "namespace": "shared",
      "owner": "authz-model",
      "scope": "shared",
      "status": "active"
    },
    {
      "id": "shared.header.forwarded-host",
      "key": "forwardedHost",
      "name": "X-Forwarded-Host",
      "channel": "http-header",
      "valueShape": "hostname",
      "description": "Forwarded host header used by consumers to choose a host-gate vocabulary record.",
      "namespace": "shared",
      "owner": "authz-model",
      "scope": "shared",
      "status": "active"
    }
  ],
  "permissions": [
    {
      "id": "personal-stack.permission.vault",
      "key": "VAULT",
      "authorityValue": "SERVICE_VAULT",
      "description": "Access vocabulary entry for the Vault service.",
      "namespace": "personal-stack",
      "owner": "personal-stack/auth-api",
      "scope": "consumer-specific",
      "status": "active"
    },
    {
      "id": "personal-stack.permission.mail",
      "key": "MAIL",
      "authorityValue": "SERVICE_MAIL",
      "description": "Access vocabulary entry for the mail administration service.",
      "namespace": "personal-stack",
      "owner": "personal-stack/auth-api",
      "scope": "consumer-specific",
      "status": "active"
    },
    {
      "id": "personal-stack.permission.n8n",
      "key": "N8N",
      "authorityValue": "SERVICE_N8N",
      "description": "Access vocabulary entry for the n8n service.",
      "namespace": "personal-stack",
      "owner": "personal-stack/auth-api",
      "scope": "consumer-specific",
      "status": "active"
    },
    {
      "id": "personal-stack.permission.grafana",
      "key": "GRAFANA",
      "authorityValue": "SERVICE_GRAFANA",
      "description": "Access vocabulary entry for the Grafana service.",
      "namespace": "personal-stack",
      "owner": "personal-stack/auth-api",
      "scope": "consumer-specific",
      "status": "active"
    },
    {
      "id": "personal-stack.permission.dashboard",
      "key": "DASHBOARD",
      "authorityValue": "SERVICE_DASHBOARD",
      "description": "Access vocabulary entry for the Kubernetes dashboard service.",
      "namespace": "personal-stack",
      "owner": "personal-stack/auth-api",
      "scope": "consumer-specific",
      "status": "active"
    },
    {
      "id": "personal-stack.permission.traefik",
      "key": "TRAEFIK",
      "authorityValue": "SERVICE_TRAEFIK",
      "description": "Access vocabulary entry for the Traefik service.",
      "namespace": "personal-stack",
      "owner": "personal-stack/auth-api",
      "scope": "consumer-specific",
      "status": "active"
    },
    {
      "id": "personal-stack.permission.rabbitmq",
      "key": "RABBITMQ",
      "authorityValue": "SERVICE_RABBITMQ",
      "description": "Access vocabulary entry for the RabbitMQ service.",
      "namespace": "personal-stack",
      "owner": "personal-stack/auth-api",
      "scope": "consumer-specific",
      "status": "active"
    },
    {
      "id": "personal-stack.permission.assistant",
      "key": "ASSISTANT",
      "authorityValue": "SERVICE_ASSISTANT",
      "description": "Access vocabulary entry for the assistant service hosts.",
      "namespace": "personal-stack",
      "owner": "personal-stack/auth-api",
      "scope": "consumer-specific",
      "status": "active"
    },
    {
      "id": "personal-stack.permission.status",
      "key": "STATUS",
      "authorityValue": "SERVICE_STATUS",
      "description": "Access vocabulary entry for the status service.",
      "namespace": "personal-stack",
      "owner": "personal-stack/auth-api",
      "scope": "consumer-specific",
      "status": "active"
    },
    {
      "id": "personal-stack.permission.jellyfin",
      "key": "JELLYFIN",
      "authorityValue": "SERVICE_JELLYFIN",
      "description": "Access vocabulary entry for the Jellyfin media service.",
      "namespace": "personal-stack",
      "owner": "personal-stack/auth-api",
      "scope": "consumer-specific",
      "status": "active"
    },
    {
      "id": "personal-stack.permission.jellyseerr",
      "key": "JELLYSEERR",
      "authorityValue": "SERVICE_JELLYSEERR",
      "description": "Access vocabulary entry for the Jellyseerr media service.",
      "namespace": "personal-stack",
      "owner": "personal-stack/auth-api",
      "scope": "consumer-specific",
      "status": "active"
    },
    {
      "id": "personal-stack.permission.sonarr",
      "key": "SONARR",
      "authorityValue": "SERVICE_SONARR",
      "description": "Access vocabulary entry for the Sonarr media service.",
      "namespace": "personal-stack",
      "owner": "personal-stack/auth-api",
      "scope": "consumer-specific",